,brand,overall,reviewText,summary
0,Nintendo,4,"I used to love this game; but now it's dated and now that I look back on it, it's not as fun now, either way, here's my review.Graphics: 8.5/10. This is a more realistic snowboarding game, so there are very realistic colors; unlike snowboarding kids or anything with very bright colors. 1080 features very realistic physics and is very sophisticated. Anyways, the graphics I remember loving mainly because of the powdery snow. I liked to edge in deep snow just because it was it was so fluffy. For that, this game got what it got in this category.Sound: 9/10. Whether you go through a foot of snow or right accross jagged ice, there's a different noise. There is a different sound for everything, which is strange because really for the most part in many games on the N64 there is the same or a very similar song for everything in the game.Control: 8/10. Very, very realistic and solid, but It's frustrating for that reason. it is really realistic so you really have to land FLAT to get land, which can be frustrating for little kids. There is also damage; so if you get beat up a lot you will not win the race.Fun: 8.5/10. Nice and realistic, great events, and different difficulties for every age and cool characters make this a must play for any  owner of an N64.9/10",Finally; a great snowboarding game.
1,Nintendo,4,"This game definitly fits the thought I had of a snowboarding game when I set out to buy one. The graphics are moderately realstic, the control is ok, and the sound is mediocre. I think they could of done a lot better job designing a game like this, but this edition suffices.It is one of the only snowboarding games on the N64, which was one of the reasons i bought it. Another reason is the outstanding multiplayer coordination. I bought this as soon as I played it at a friend's house. You unfortunatley play with only 2 players at a time, but it is still fun to play your friend head to head.  There are 6 courses, and under single player you can also do half pipe and air make. There are 5 characters that you can use to race, and more of which you can unlock. since there are only 60 head to head course combinations, there are other things you can do, like trick or time attacks.This can take a bit to get used to, as it can be boring for the single player. If you have a will and a friend however, this game will surely be worth it.",An Adequate N64 snowboarding game.
3,Nintendo,4,"In comparison to other N64 games, this piece is a worthwhile buy.  The single player mode is challenging enough to warrant playing for a while to unlock the secret characters.  Two player mode gets pretty boring, pretty quickly because there are only 6 tracks to race on so there's not much variety.  The stunt mode is the main appeal of the game and could easily occupy you for hours.  However, it soon just becomes a thumb spinning frenzy for points.  Given this is fun for a while but it gets all that white junk inside the control stick holder, and ruins thumb coordination for the rest of the day.  So buy this game and spin in circles to your heart's content.",1080 Degrees of Thumb Rotation
5,Nintendo,5,"The game in many ways is like tony hawk.  In fact, the only differnt thing this snowboarding.  The graphic and gameplay are good.  With 5 differnt boarders to use and alot of tracks, the game is worth the money.","Like Tony Hawk, this game is a classic!"
6,Nintendo,5,"I'm 23 now, got the game when it first came out when I was around 12. Still the bet snowboarding game of all time. So much fun that I still get the n64 out here and there simply to play this game. Has a time attack mode, trick mode, racing series, and a mixture of them all. Just a great classic that rates up their with 007 Goldeneye for classic N64 games that could last forever for those every now and then gamers like myself. Great game...that's highly reccomended.",Awesome...
7,Nintendo,5,"When my cousin first got this on his birthday, I was thinking &quot; this is just gonna be like all the other snowboarding games I've played&quot;.  Man was I wrong!  With 8 levels of exciting, heart stopping jump, twists and turns, this is one game you don't wanna miss.  It has all the best modes, Match Race&lt;this is where you earn hidden levels against the computer&gt;, 2 Player, Trick Attack, Time Attack,and Contest, this is one game that won't get tiring fast.  Heed this warning:if you buy this game, don't go after the 1080 just yet, it's hard to master.  What more do I have to say?  Buy this game!",1080-best snowboarding game to date
8,Nintendo,5,"Once you get the hang of the controls, this game is awesome... it's challenging and entertaining, and everyone should have one.This game has amazing graphics-- you can even see the snow spray off the board when you make the slightest turn. Plus, the camera controls are flawless. The sound track is pretty good, too- you can hear the snowboard scraping and the snowboarders sometimes talk, and the techo tracks that accompany the races are pretty cool too.My only complaint is that there aren't enough courses. After I unlocked the 6 courses and beat the &quot;Black Diamond&quot; level, there wasn't much else to do. But even after you've unlocked all the courses, it's still fun to play against your friends in the 2 Person VS mode, or doing tricks in the half pipe.I think that anyone who has a N64 should add this game to their collection, without a doubt... it's a solid game, and you won't regret it.",A Must-Buy for everyone's N64 Collection...
10,Nintendo,5,"Without any doubt, 1080 Snowboarding is probably the best snowboarding game available.The difficulty of the controls are a little more difficult than other snowboarding games and may take a little bit more time to master, but it's well worth it. Landing correctly is also a little harder to do than normal.The mode and track selection is very nice, offering a nice variety of tracks and available modes. The tracks offer beautiful scenery, sometimes very big jumps, jumping over cars, and a lot more.The tricks and the stunts selection that you can perform is very reasonable. Although you can't go beyond 1080 degree turns, there are other tricks that you might not find in any other snowboarding game.1080 also includes a Training mode, which includes two different sections, the halfpipe and a straight run with moguls. When you begin, you can turn into the left gate for the halfpipe to practice your tricks, or you can head into the right gate for a straight downhill run with moguls scattered all over. When you finish, you start back up at the main gate and you keep going until you decide to quit.1080 also has a few secret riders and boards within the game.Overall, 1080 is probably the best snowboarding game around, without any doubt. Would be definitely worth buying.","The best snowboarding game, hands down."
11,Nintendo,4,This is the best Snow boarding game you can get but you will get tierd of it soon,Best Snow board game
13,Nintendo,5,I love the Nintendo 64! I still play some games occasionally and this one was always a fun one. It will frustrate you though!,Fun game
14,Nintendo,5,"This was the first real game I ever played along with the first I ever owned. Despite the fact that I've grown out of many kids games and spend my time focused on M-rated games with a lot of violence or sexual themes, this is one of those games I most definitely have not grown out of. I love the tracks, the weapons, the characters(Yoshi's my favorite), and simplely how much fun this game still delivers to this very day. The replay value is endless, and multiplayer is still very engaging(It's always fun to humiliate your friends at this game). This game is what got me started on games and it will continue to be one of my most memorable games in my life as a gamer.",NEVER GETS OLD 9.5 OUT OF 10
15,Nintendo,5,"It has spawned such classic levels (as I recall) such as Luigi's Circuit, Moo Moo Farm, Frappe's Snowland, Toad's Turnpike, Koopa Troopa Beach, Banshee Highway, Bowser's (infamous) Castle, Wario's Stadium and the ridiculously long and bright track, Rainbow Road, which has spawned at LEAST 5 different versions throughout the series!My all-time favorite level in the game is actually Sherbet Land. It's filled with ice and is just fun to cruise through! And the penguins that you can run into are so cute!The playable characters are your basic eight: Mario (balance), Luigi (balanced), Princess Peach (lightweight), Toad (lightweight), Yoshi (advanced), Donkey Kong (heavyweight), Wario (heavyweight) and Bowser (the heavi""est""weight).This game is very, VERY easy to just pick up and play with friends. The controls are simple as all get out and the characters look pretty cool, for a N64 game. The sounds they make are cool too!If you want something that 4 guys (and/or girls) can enjoy, this is the right move!* PROS *-Bright, colorful boards.-Addicting sound effects.-Semi-interesting characters.-Fun tracks.-4-Way BATTLE. Nuff said.-8 Semi-unique characters* CONS *-Sound comes through in 1-player or 2-player mode, but fails to when playing with 2 or 3 friends-16 levels just isn't enough to satisfy the average gamer's thirst-The music can be annoying/nauseating to some-When you're in 1st, you get crappy items. When you're last, you get the best ones, usually landing you in 1st/2nd/3rdCons aside, I spent countless hours with friends that I cherished playing this game. It will bring smiles to your faces for months to come. If you like this and own a Nintendo DS or a DS Lite (shame on ALL of you who don't!), then I totally recommend Mario Kart DS also. More levels and more mayhem. Did I mention even more characters?!4.5 stars.",Great game overall.
16,Nintendo,5,"even with all the improvements in systems, games, graphics, etc., this one remains a classic in all sense of the word.",classic game
17,Nintendo,5,"People say GoldenEye was a much multiplayer than this game, but I've spent more happy hours racing my friends in Mario Kart 64 than blowing people up with proximity mines in the Complex in GoldenEye.Lots of people extol the graphics in GoldenEye, but graphics in Mario Kart 64 is better. First of all, it has a lower polygon count and the characters look much better. The gameplay is simple, but that only means it's easier to learn. The card that comes with the game tells you everything you need to know so all you have to do is plop the game inside the console and start playing.So the characters don't say much. It's mainly just a simple &quot;Yippee!&quot; or &quot;I'm-a Wario and I'm-a gonna win!,&quot; but there's much more in-game speech than GoldenEye. Sound effects are fine too. The soundtrack is excellent. It ranges from coutry to smooth jazz. Even some major critics of video game music I know have said that the music here is great. You know Koji Kondo's doing something right hearing that.Mario Kart 64 is addicting with four players, and it can be addicting with one player too. The Time Trials may be a little disappointing, but the Mario GP had me coming back for more.The game is one of the best racing games on the N64. It's better than WaveRace, Diddy Kong Racing, F-Zero X, and even Excitebike 64. Heck it's one of the best games on the N64! If you haven't played this game, then you don't know what you're missing.",The Game of 1997!
18,Nintendo,5,"This was the first 'Kart' game quite like this.. there isn't any 'Kart' game like this either outside of the Mario franchise. If you think you can find a better Karting game out there, I'd like to see you find it and show me, because from my finds and plays, this is the only game that is worth playing. From DK to Bowser, Peach to Toad, this game has most of the characters that have been involved with Mario in some way. The graphics are great for its time, the sound is fun, the worlds are colorful, the idea is great. Who wouldn't like this game- at ANY age? I'm not sure, but if you don't, you amy need to see a doctor. This is the best Kart game ever, and the best Mario Kart game ever.",Amazing
19,Nintendo,5,I have loved this game from day 1. I was happy to find it and receive it quickly and safely.,Very Happy
20,Nintendo,5,Cool game.But I think Toad is the fastest of the crew. I usedto be an expert at it.I was even born an expert....,A cool game Even better than Super Mario Kart super circuit.
21,Nintendo,5,"Excellent game all around except one thing....The game CHEATS.You can be in first place and magically all the computer controlled racers somehow manage to catch up to you anyway.Now, if you're in last place you literally have no chance of catching up.Not fair.Not cool.That aside....if you develop your skills you'll still win.After much practice I still managed to beat the game even though it blatantly cheats.Great graphics.Every character you love from the Mario universe.I think Toad is my favorite, when he gets hit LOL. The noise he (it?) makes is hilarious.The courses are inventive and enjoyable.The music fits in perfectly.Did I mention it cheats?That's my only complaint.Otherwise another five star winner from Nintendo.Highly recommended.",Incredible racer.
22,Nintendo,4,"This is a must-have for your N64.  It is fun to play by yourself, but the most fun is when you play with 1-3 friends.  :)  The graphics are not the greatest, but it usually doesn't affect the gameplay.  A classic N64 game.",Mario Kart 64
23,Nintendo,5,I used to play this game all the time when I was a kid. I recently came into an N64 and just had to get it. Game works perfectly and it arrived quickly.,Memories
24,Nintendo,5,"This is an excellent game! Once you start playing you cannot stop until you actually beat it! This has averythingn a GOOD game should have: Excellent graphics, excellent gameplay, good2-player mode, and good sound. The only flaw in this game is... well... their are no flaws, this game gets a SOLID 5. Thanks for reading my review. Happy Gaming. P.S. Don't buy Pokemon Snap... Thanks!",EXCELLENT Game
25,Nintendo,5,"Truly a classic. This game was one of the first I got for the N64, and it is one of my favorites today. As it gives graphics that were hardly ever seen in the early N64 days, it also has gameplay almost unmatched by the games of it's era. The sound is moderate, but sound isnt a very big facter in deciding the rating of the game.A followup on the early SNES version that was also a hit, this game was certainly watched before it's release date, as it stormed into the N64 world and took many fans (as you can see from it's very high review in many chances) right away. It was considered as a very high class game then, and now too. Many of the N64 owners today have one in their hands, and many of those have played the game for over 24 hrs.This game has wonderful graphics and sound for the era that it was made in. The size of a typical game back then, but with the technical advancements of some of the games today. The graphics are very good, as you can distinguish all characters and objects faster than immediatly. The game also shows no slow down rate no matter how many characters or items are on the screen at the same time.  The sound is entertaining for a while, and it is different for almost all of the 16 courses, showing wonderful compositions with goofy sound added noises at parts.The gameplay is also great. You may pick one of 8 characters to race with. On a small go - cart, you must race on one of the 16 courses and try to get in first. There are many modes. You can race with a group of 8 racers in a grand prix mode, where you may race a total of 4 races and accumulate points. A vs. mode race will put you against a friend or 2 (or 3) in a single race. There is also a battle mode, which will put you against 1 to 3 other players where the last one alive wins.The items in the game play a big part. Some will boost your speed, while some are used to slow down enemies. Some steal enemies items, and some let you do things such as go invincible or invisible. Most of the however, are used to smash your opponents into the air and slow them down. In battle, it will be used as one of 3 hits to destroy the enemy.The characters are the typical mario game characters:  Mario, Luigi, Peach, Toad, Yoshi, Wario, DK, and Bowser. They should all come in handy sometime in the game, and it should be fun to test them all.OVerall, this game is great for having fun. I reccommend it to any one. Great for technology too. This game is right for you.",One of the early N64 games
26,Nintendo,5,"This is a really cool game. I played this to death i don't know how many times, sometimes alone and at times with a partner.It's really tragic if you don't have this game when you own an N64, you don't know what you're  missing out on.Um...well, this game is pretty easy and you don't really  need a strategy guidebook for this one. I think the only reason why it's so  damn fun is because on every track and race, you can race it differently.  You can try new tricks or even attempt to create your own shortcut-if you  are that good!Graphics-wise, it's all a let-down, i was expecting  realistic models but i got cartoony characters, but then again- it's mario  and friends, right?As a mario fan- you'll want to have this in your  hands and if you're not- then play this as a party game. It beats Mario  Party in replay value but is somewhat less challenging.So bottomline-  it's a little too easy. But that will not prevent it from being a top 100  game of all time (read EGM #100)....",Replay Heaven
27,Nintendo,5,"This game is one of two reasons to buy an N64.  It's excellent multiplayer, with enough shortcuts and tricks to perfect that's it's also a great solo game.  If you have an N64 and you don't have this game, then you should stop wasting your time and go out and buy it.  You could play the other games, but they are terrible...",Put this one in your &quot;Kart&quot;
28,Nintendo,5,"This is the best racing game i've ever played and the most funest. The game has a cool unique to a racing game. it is tons of fun, and you can play either Mario, Luigi, Peach (The Princess), Toad, Yoshi, Bowser(King Koopa) & Donkey Kong. There are three types of trophies you can recieve, either the Mushroom trophy, Flower Trophy, Star Trophy and A Special Trophy. Cool Hu. Well this game was tons of fun i recomend it to everyone. Peace OutIf you liked this game then check out all of the Mario Games.","An Excellent Game,"
29,Nintendo,4,"Ahhhh! I love this game! It's so great. My friend gave it to me and I fell in love with it fast! I played Mario Kart for the SNES and thought it was the best thing since sliced bread. When I found out Mario Kart was for N64, I went bezerk. This was the first game to my N64 collection. You choose between 8 characters. You can get over 10 different powerups, including the legendary star which makes you invincible, banana peels which make opponents skid out of control, lightning bolts which makes characters small so you can smush them, mushrooms that boost your engine, and 3 kinds of shells. A green shell will go and bounce off anything, A red shell will do its best to find a character and smash them, and a spike shell with automatically find the player in 1st place and destroy them without fault. The reason it is 4 stars is because they didn't go the extra mile. If you play 1 or 2 player(s) you can do a Grand Prix, but not with 3 or 4. In player 1 mode you cant do a battle or do a vs. with the CPU. Battle only contains 4 tracks. I guess what i'm trying to say is that i wish it was more open. Taking shortcuts won't work because Lukita drags you back when your at the top of the mountain. This game would be the best if you were allowed to do more.",Just like Mario Party but you race all day!
30,Nintendo,4,"When I had this game, I did not stop playing until I got to winning the game. It's fun for awhile to throw objects at people that are racing against you. It has a four player mode, which is not bad, but sometimes gets a little confusing when you're watching other people racing. The split screen should never be included. Although, that it is which is easy to get distracted. But Mario Kart is fun and it should be in one of the hand-held games, too. I wouldn't mind playing this. Oh, I have the one on Gameboy Advance, which is cool but not like the one from Nintendo 64. Now, that confused me.",Mario Kart is Fun!
31,Nintendo,5,It plays great and i look forward to beating my fance. We place bets on who will win and the looser has to do the chores.,Great game
32,Nintendo,5,"mario kart 64 is by far the best n64 gameif you want non-violent racing with all the nintendo characters for a good price- look no furtheralso if you like mario kart 64, you might likemario kart dsmario kart super curcuitmario kart snes",Very Fun Mario Kart game
33,Nintendo,5,"Mario Kart 64, the sequel to the first Mario Kart game on the SNES is great. Nintendo got rid of some of the things that made the SNES title so much fun, but added a lot too. The gameplay is much more enhanced, the characters look much better and the individual go-karts are very realistic.Like the SNES version, this game includes 3 modes of play: GP (Grand Prix), Battle, and Time Trial. In GP you choose one of 8 characters: Mario, Luigi, Peach, Toad, Wario, Yoshi, Donkey Kong, and Bowser in a large variety of courses in the Mushroom Cup, Flower Cup Star Cup, or Special Cup (which you unlike by getting gold trophies in each of the 3 basic courses) in 50cc, 100cc, or 150cc mode. 50cc is the easiest, but in 100cc and 150cc the computer gets much faster and more challenging. There are several items you can collect by driving through the question mark boxes which help you during each race. Lightning bolts (the rarest item to get) makes all of the other opponents small, mushrooms give you a speed burst, banana peels make one of your opponents crash if they slip on it, red shells are used to shoot directly at an opponent to get them off course, and green shells keep bouncing off the walls until it hits one of the racers. Unlike the SNES Mairo Kart game, there are several objects you need to avoid to stay on course. In different races there are trucks and cars that will make you crash if you hit them, snowmen that will blow up if you hit them, and many other obstacles in different courses.In Battle mode you and up to 3 others choose one of the 8 characters. You drive around a course trying to pop each other's 3 balloons. You can pop their balloons by shooting red or green shells at them or throwing banana peels at them to make them slip. You can also use the other items to avoid being hit by them. Once all of your balloons are popped you become a bomb which you can drive around the course trying to run in to the other players. This mode is a lot of fun, especially if you get tired of continually playing Grand Prix mode.In Time Trial mode you race in any of 15+ courses and try to set records for each lap and/or race.The controls for Mario Kart 64 are very simple and easy to master, and the music and sound effects are great as well.If you want a great racing game for your N64, I highly recommend that you check out Mario Kart 64.",One of the best racing games on the N64
34,Nintendo,5,"It's a classic, anyone that has a N64 should have this game.",A+
35,Nintendo,5,"Classic racing game. If you love racing games you should consider getting this game. You race around tracks throwing random stuff so that you can win. The graphics are great-- I mean during that time the graphics are great, you can't really argue about that.",Mario Kart 64
36,Nintendo,4,"Graphics: 9/10 - Eye-catching, bold and pretty, Mario Kart 64's graphics are fulfilling and nice to look at.Sound: 8/10 - Lots of bells, whistles, engines and da-da's in this game. They are just small sound, but bring out some sort of livelihood.Value: 8/10 - Even though I don't have a Nintendo 64, if I did, I would probably buy this game because it is lots of fun to play. It can also be very strategic at times, which is good for a racing car game.Overall: 8/10 - Nothing too memorable, but it's delightfully entertaining to play when you are actually using the controls. Mario Kart 64 gives you things to do and stuff to work out. It's the first game I played on Nintendo 64 and as far as I'm concerned, it's well worth the time.",Neat N64 game!
37,Nintendo,4,"This game is really fun, but I honestly enjoyed Crash Team Racing for the PlayStation a lot more. One thing that annoys me about this game is that you can't look behind you. I pressed every button and I can't get the camera to face behind the racer and this makes it impossible to shoot green turtle shells from behind without proper aiming. So nine out of ten times, I'm going to miss my target. How did Nintendo screw up this badly. And the racers are pre-rendered much like how Donkey Kong and Diddy Kong were in Donkey Kong Country for the SNES. I was wondering why wasn't it computer generated like Super Mario 64? It's still a nice little game, a little pricey, but still nice to have in your N64 collection.",Fun Game
