,brand,overall,reviewText,summary
200,Nintendo,5,"Hey all you people, this game is an absolute good. Barely any flaws and it is like you are playing the game in reality. This is a 5 star game.Why, you ask? This is the proof:1.Gameplay- It takes you a while to master the controls and stuff, but with practice, this wouldn't be frustrating at all!2.Graphics- Great! As I said, everything is 3-D like the Deku Tree and Link himself. Take a look!3.Lifespan- I heard that people who knows Zelda games really well could beat this in a week. But you guys out there that is starting a new adventure, would last forever for no boring parts of the game. There is a lot of words to say, but its worth it.4.Fun-This game is a 99.8 fun game, in my opinion of course. I am stuck on the Deku tree of how to get past the spiders. See, challenging, and fun!5.Sound-You gotta be kidding me! The Sound and music is great! Different sounds occur in different environments for the better!Listen Closely!6.Overall- This game is an absolute no miss game! Guranteed. This is a good game who likes RPG, or collects Zelda Games. This is, (I think) better than Majora's Mask. This Game Follows the Legend!!! Honestly.","""The Legend Goes On In This Action-Packed Adventure!"""
201,Nintendo,5,like all zelda games the ocarina of time provides an adventure about link a young hero.in the ocarina of the player takes control of a young boy known as link. right from the start of the game players jaws dropped at the sight of the graphics for 64 bit graphics it looks amazing.as the story progresses players obtain more items and link becomes more of a hero at about 2 thirds through the player becomes an adult and he cant use some of his items which is one the most impressive features in a game iv ever seen. Its about an ancient evil being restored and a child giving up his youth for his country theres nothing bloody wrong with this game its perfect.p.sthis game is why you keep your n64,an incredible adventure that never gets old
202,Nintendo,5,"Legend of Zelda: Ocarina of Time is one of my favorite games ever!  I just love the storyline and the characters,even though Link, Ganondorf and Zelda have been in all of the Zelda games, but this game is the best.  The original Legend of Zelda for the Nintendo was okay, but it felt like the game would NEVER end!  I recommend this game to fantasy lovers who also love the idea of a super villan an action-ready hero.  This is also one of Nintendo's classics.  Everything a fantasy story needs is right in this game.",The best of all Zelda games
203,Nintendo,5,Im not even that far(I just got past those guards)but I can tell this is a classic example of electronic excellence and is a classic that anyone lucky enough to know its out there can discover.,Game is awesome
204,Nintendo,5,"I played this game and never wanted to stop. In my opinion, this is the best RPG game ever. It is fun just to play, and run around. The graphics are great, and it is just plain fun. What is also nice is that getting past certain parts of levels aren't very hard, and you don't get upset playing it.Pros:1) Great graphics2) Great plot/storyline3) Characters look great4) Easy figuring out what to do5) Just plain funCons:1) Ummm",The best RPG game of all time!
205,Nintendo,5,"Zelda OCT is an action-adventure RPG (there is debate about this, and some argue Zelda is it's own genre) with a combination of puzzles, fighting, and racing. Anyone who enjoys this genre will be enthralled by OCT (which you can play on several Nintendo platforms including the 64 and Gamecube). I still play Zelda OCT 10+ years later on the Gamecube from time to time, it's that good of a game.Graphics:For the time period, Zelda OCT on the 64 was beautiful and it has stood the test of time FAR better than other older games on consoles. It was the first truly 3D game for a console and set the standard for what video games should look like. If you grew up on newer systems and PC's, these graphics will look ""blocky"" to you, but the Gamecube has an OCT version with more refined graphics. Still, if you want a ""retro"" video game experience, the N64 Zelda OCT has graphics that are still enjoyable today.Story:The Zelda story is perfect for a video game, as the basic premise is always the same. Link, a young boy (or young man in newer games), is the reincarnated hero of time. He must battle the evil Ganon/Ganondorf to save Hyrule and princess Zelda by using the power of the Triforce.Zelda OCT molds the ""Zelda Story"" into a fantastic tale that will take a least a few months to beat for your first time. The game's puzzles become progressively more difficult, culminating in the notoriously challenging dungeon - the Water Temple. The story combines several races (Hylians, Kokiri, Gerudo, Gorons, and Zora) seamlessly into one large kingdom. The enemies are varied and interesting as well. The Fantasy-Adventure story line is complex and intricate, complete with twists and shocks, time-travel, and genocide. Time affects the characters, and you see that not everyone loses when evil prevails. The story details are amazingly deep, to the point that pictures on someone's wall and the clothes they wear can fill in some back story of that character. I loved the detail and enjoyed filling in little pieces of the ""back story"" by talking to the NPCs and looking through the first person scope at their tattoos and clothes. The main story is also amazing, with the typical epic sword-clashing adventure ingeniously employed in the Zelda OCT universe. It's truly a master's greatest work.Game Play:The 64 had a simple controller for fun game play. There are only a few buttons, A, B, Z, C-pad, R1, L1, joystick, and the D-pad. The D-pad isn't needed in Zelda 64. This limited key selection was used to build an elegant fighting system around a few button combinations. Although B always attacks and A always does ""an action"", the genius of this system falls in the types of attacks you can do. Depending on the way your character is moving, and whether or not an item is targeted, Link can perform an impressive list of sword attacks (vertical cut, horizontal slash, diagonal slash, spin attack, thrust, and jump attacks). Despite the fact that B, Z, and the joystick are the only buttons that control these moves, Link is easy to control and I never had problems getting Link to perform the combination of moves I desired. Link could cut any sign into 5 unique pieces consistently - that is excellent controller response!In addition to the perfect synchronization of Link to the game controls (something newer games like Dark Souls could take a lesson on) the game play is interesting and varied. Although the main fighting style will be slashing it up with your sword, each monster has a unique weakness that you can take advantage of with a variety of weapons. Link not only totes a one-handed sword and shield, but he also get's access to a sling shot and deku seeds, boomerang, hook shot, bow and arrows, bombs, deku sticks, deku nuts, and two impressive two-handed weapons: a hammer and a sword. These weapons can all be used in different ways to different effects at various times in the games.Although the game would have been interesting enough with just those weapons, the game is further varied by magic. Link can wield three types of hand magic, as well as three types of magic arrows. This adds another level of monster fighting, where Link tries to find the weakness so he can move in and dice them up.Apart from the impressive array of weapons, Link also packs a varied wardrobe. The stoic hero is far from interested in fashion (I mean, he runs around in a tunic and tights with a long cap, so he obviously doesn't care about his looks), so each piece has a specific use. You can mix and match boots and tunics for different benefits. Some bosses can only be beat with the right combination of clothing and shields, and figuring out how to use which items against a difficult boss is part of what makes Zelda OCT a great game.Wait, there's still more to combat. Apart from the variety of moves and effects Link can muster with his impressive array of items, there is also horseback combat. You can ride around on Epona, a fierce, wild, mare who only listens to you, and shoot things with your bow and arrow. There are also mini games centered around the fun and challenging horseback combat.Summary:Zelda OCT is an excellent Action-Adventure RPG with an epic story line that seamlessly melds a complex kingdom and elegant fighting style into a grand video game. The characters are interesting, with even the most minor sentinels having a back story that you can uncover. The main story is fun to progress through, and you care about a lot of the characters you meet. The controls are excellent and perfectly integrated for fun, non-frustrating, game play. The bosses are challenging, requiring wit to uncover their weakness from the surroundings and circumstances before you can move in and damage them with your sword.Final Note:If the 64 is too retro for you, Zelda OCT has been remade for the Gamecube with newer graphics. However, the Gamecube controller does not integrate as seamlessly as the 64 (understandably) so you will miss out on a large part of what made Zelda 64 great. Additionally, there is a 3DS version, but I haven't played that so I really can't comment.",My Favorite Game of All Time
206,Nintendo,5,"This is the best game I have ever played.It has very good music,grapics,and the story is great!I really love this game,but the only really big problem with this game is that it has this one(long and boring)temple that is very hard,and(please)don't take this game lightly,the bosses are hard,but the story is so good that you will want to play this game again and again!But the other Zelda games are lame!So only (if you want to)buy this game and maybe 'the legend Zelda A link to the past'.  PROS:the story is great,It's a fun game,and the great fairys(Fairys that will power you up and give you new weapons) are easy to find.  CONS:switching around the camera is a little bit hard,and finding the goldskull tokens(gold coin like tokens that you win from beating spider monsters)is easy at the beginning of the game but hard at the end.  This is a great game,so I would recommend it to anyone who likes fantasy games,I would also recommend'final fantasyI&II dawn of souls'and'The legend of zelda:the wind waker'.",Why can't there be more games like this one!?!
207,Nintendo,5,"Although the Final Fantasy series was pretty good, no other RPG can compare to this.With a very long storyline, and if you don't have a strategy guide handy, there's a possibility that it might take a while to finish the game completely.The features are just amazing. At some points, you are required to move into the future 7 years, where Link is a full-grown adult, and sometimes back 7 years to advance in your journey. As an adult, some things will have changed. And when day turns to night and vice versa, some things will change that will be different when compared to the same place, only in the daytime.The battles are intense. And as for the boss battles, the bosses have a variety of options that they can do, and to effectively defend, you usually have to be prepared for any &quot;curves&quot; that they throw at you.Legend of Zelda: OoT holds a lot of replay value. Even after I've finished the game, I'm still having a great time.Overall, Legend of Zelda: OoT is probably one of the best RPGs available. Would be definitely worth buying and would also make a wonderful gift!",No other RPG can compare to this.
208,Nintendo,4,"This is still a great game to own, especialy if you missed it, but the graphics are dated.  If you have a GameCube, find a way to get it on there, and be happy you did.",Good back then
209,Nintendo,5,THIS IS THE MOST ABSOLUTE SUPERIOR GAME EVER MADE! You have almost no limits as to what you can do and there is always another secret or trick you can learn! Not only this but there are no limits to the fun you can have with this game. I enjoy the challenges and puzzles and new items and moves you have to get. If you are going to buy a game for Nintendo 64 this is the game to buy!!!,A good review done by the Smantie
210,Nintendo,4,"This game was a tad on the easy side for the most part, but it was still great fun. One of the best Zelda games. Cool places to explore and neat items to find.",Great Game
211,Nintendo,5,"Thinking back on the times of Zelda, have got me thinking. The game was absolutely breath taking, I remember how fun and exciting it was, and it was so good, because of the challenge. If there is still anyone who has not played and beaten this game, please get it, it is totally worth the money. Then in 4 or 5 years, you too can think of what a great game Zelda was, but then you will feel bad for neglecting your Nintendo 64 and playing your PS2, but PS2's time for neglection will come in a few years also.",I will Remember the Magic
212,Nintendo,5,"Although I like the SNES Zelda best, you really can't make a game better than this one.  Sometimes a game is made that goes above and beyond 5 stars.  This game is like that.A vast amount of items, all found in unique ways.  Awesome.  Lots of giant evil bosses.  Awesome.  Lots of underground hidden stuff.  Awesome.  Lots of weird folk to talk to.  Awesome.  Time travel in a HUGE mythical world.  Awesome.  Lots of mini-games to play for cool prizes.  Awesome.  Just so many awesome things packed into this ONE game.  I usually only recommend rentals, but a rental wouldn't do this game justice.  You have to buy it, you have to beat it, and you have to find every secret.  Live this game, and every now and then, live it again.I'll also recommend buying some kind of strategy guide, or looking for tips online to find everything.  I've heard that there is a giant monsterous eel-like fish in the pond, but I have yet to catch anything like that.",Perfect
213,Nintendo,5,BY FAR ONE OF BEST ZELDA GAMES OF ALL TIME. I HIGHLY RECOMMEND THIS GAME. WELL WORTH THE MONEY.,Zelda
214,Nintendo,5,"This is, to me, not only the greatest Zelda game in the series, but also the greatest game I've ever play.Where to begin? There is so much in this game that makes it so fun. I absolutely love the side quests. Getting the Biggoron Sword is a race against time, but very rewarding considering you will posess an awesome huge sword that is twice as powerful as the Master Sword!Another side quest I loved was completing the Gerudo Training Fortress to get the Ice arrows. This will force you to use all your skills and items, and will really put you to the test. I would even venture to say that the Gerudo training temple is more difficult than almost every other dungeon.The ghost hunting side quest is very tough and takes practice and patience. Capture all 10 big poes roaming the field of hyrule and sell them to the strange ghost shop. You will get the 4th bottle (the hardest to get)Even the mask salesman side quest is very interesting and unique. While many wouldn't bother to complete it, but the reward is the very cool and mysterious ""Mask of Truth"". Furthermore, this side quest is slightly more significant considering that the masks are the focal point in the follow up ""Majoras' Mask"".But of course, my favorite side quest is the Skulltula side quest. It is very long and trying, but definitely worth it. This is another side quest many people wouldn't bother to complete, but completing it does have it's merits. For example: there is a very profitable rewards system in play. Destroy 10 Golden Skulltulas, and you get the adult wallet (holds 200 rupees). At 20, you get the stone of agony, which (when playing with a rumble pack inserted) will alert the player when a secret is nearby. At 30, get the Giant's Wallet and you can carry 500 rupees. At 40 you get Bombchus (I know, lame). At 50, get a piece of heart. After that, you get nothing more unless you manage to destroy all 100 golden skultullas. Doing this will result in you being able to get 200 rupees every time you visit the house of skultulla. Unlimited money is very cool, although a bit useless at that late a stage in the game.The bosses are great. I won't go into great detail, but I've always loved the fight with Volvagia the lava dragon. There is something so classic and satisfying about watching Link defeat a lava dragon in a volcano with the master sword and hylian shield. Also, the final battle with Gannondorf is a real treat, and I never get tired of firing the magic arrows of light at him. The fight has a very epic quality to it, and the final battle against the horribly mutated Gannon has a nightmarish ambience to it.The temples all have thier own awesome themes, both musically and environmentally. I always thought that the Forest Temple was incredibly imaginative and just stunning. It has the feel of something abandoned to the wild with overgrown vines overtaking the temple, and the open courtyard.The music is top-notch even by today's standards. Koji Kondo really put together a masterpiece.There is even a sweet element of sadness in Link's lost childhood, with the loss of his friendship to Saria. The moments where Shiek teaches you a song to warp to a temple always has a reference to a long lost friendship or the somewhat cruel passage of time.The ability to customize adult Link's appearance is pretty unique and cool where you can choose with color tunic he wears, which sword and shield to wield.In short, this is a wonderful game that will always have a special place in my heart.",Link's Greatest Adventure
215,Nintendo,5,"This game is one of the finest Video games ever produced, while its graphics may be some what dated by today's standards its epic story and play control are arguably better than many of today's titles.I cannot recommend this game enough.","a legendary game, timeless fun."
216,Nintendo,5,The Legend of Zelda: Ocarina of Time is the greatest game in the entire Legend of Zelda video game series.  Period.'Nuff said.,The Best Game In The Series!!!
217,Nintendo,5,"awesome storyline, awesome graphics. perfect game! great challenge, but not too challenging that you cant beat it. Thanx nintendo for the greateast game ever made!! Great game for all ages! highly recommended!!",BEST GAME ON EARTH!
218,Nintendo,5,"This is the best N64 (R.I.P.) game I have ever played. It's full of vast 3D worlds, cool characters, and has a deep storyline. The worlds are huge.Take Hyrule Field, A place which has absolutely nothing to do with the story but going there to get new places, is soooo much fun. When you aren't doing anything and are just playing around, you can have hours of fun running around hunting skullkids and running from those flying spikey flower thingies. When you're an adult, you can hunt poes (ghosts) in the field and get rewards and stuff for it! Anyway, the story is about a boy named Link who is destined to save his home world, Hyrule, from A powerful wizard. The wizard wants to get ahold of the Triforce, an ancient artifact which has the power to alter the world. He does, and changes the world to a ""hell"". Link then has to go through many dungeons and meet many people and eventully save his land of Hyrule and return peace. That's about it. Peace.",Whatever is this?
219,Nintendo,5,"everything a video game is supposed to be! Lots visually diverse landscapes and effects, intriguing gameplay and endless oppotunities for exploration within the framework of the game. No boring moments here! The horse is certainly a nice touch (being a bit of a horse fanatic myself). Provides a fairly lifelike representation of horse riding. Nice soundtrack, and the interactive music play was quite satisfying. All in all a well designed game. Wish they were all this good!",entertaining... for hours and hours
220,Nintendo,5,"Zelda: Ocarina of Time is a well-made game that perfectly blends battle sequences and puzzles.  The battles, which can only be won using the right method against the right enemy, are simplified by Z-Targeting, which aims all attacks at the enemy.  It takes a long time to beat (months), as any good RPG (Role-Playing Game) should.  Unfortunately, it constantly and inevitably reminds you of the controls, although they're pretty easy, in messages which you usually must read.  I suggest this for all people, especially those that enjoy a good challenge.","Fun, Long-Lasting, and Annoying"
221,Nintendo,4,"I got this game because every person said it was the best game ever. For 1998 it is, but now it's just good. Not as good as wind waker or twilight princess. The level design is good. Parts are 3d, others are resident evil camera. In short it works okay, but I screwed up many times becaus of it. the graphics were good several years ago, but now they are muddy and polygonal. Aside from that, it's zelda. Nothing new. If you buy it, don't expect it to live up to all the hype.",Not as good as the hype
222,Nintendo,5,"There always comes along trend setters that some how cannot be bettered! Zelda is one of those games ,its challenging enjoyable adventurous fun!!!!!!!!!!! i loved every minute of it even though at times i wanted root out my hair i have no regrets having this game in my collection,one of the best games ever on 64.even though the 64 era has ended if you are a die hard gamer from time to time you may want to go back this game is definitely worth playing again and again there's always something you would have miss that you can find the next time around.",Zelda is a trend setter!!!!!!!!!!!!!!!!!!!!!!!!
223,Nintendo,5,"This title might be the best game ever. The best title for the N64 it is, beyond any doubts.- Graphics: I haven't played much N64, but, for all I know, this is the best you can get in the plataform. Beautiful enviroment, landscapes, well-designed characters, different places and detailed textures for this plataform. The graphics are hot, I mean it! And you didn't even need graphics, this game would be great even without them. This game will be forever known because it has changed the world of games with such 3D graphics plus the lock-on camera, this game will be forever reminded because of that. Approved graphics.- Sound: This game has the best soundtrack ever, if you ask me... Nearly every song in this game wins a 10/10 score. I really want to find a soundtrack for this game, because both the Ocarina songs and the in-game songs are awesome. Characters don't have voices, except when they scream, when they're scared and this kind of thing, so the voice acting isn't great. But the sound wins a 9/10 because of the nearly perfect soundtrack.- Fun: This game touches you with a great story, great characters, great songs. You really feel as if you were Link in the beautiful land of Hyrule, and that makes the game so good that you can't say it's not fun. When you feel like the character, you just can't stop playing, even in the boring parts (in other words, the Water and Fire Temples). The different times you play and the many secrets hidden (I mean it, many secrets, I highly doubt you can get them all!) makes the game even greater, even more perfect.- Educative: I really don't know why this game is rated E for Everyone... I feel like the game has some scary parts (in other words, the cemitery and the Shadow Temple), so it should be rated T for Teen, even though it has no great violence, no red blood (just green blood sometimes). But you parents shouldn't worry about that. This beauty must be taken to your children.Overall, there's nothing to say. I don't know what you're doing reading my review if you haven't played this game yet. This is one of those games you must beat during your lifetime (The Wind Waker, the last game in the series, is very good, but it isn't nearly as good as Ocarina Of Time). It might take a long time for you to beat it if you're always busy, because the game is not short, but you must try. It'll be an unforgettable experience to be Link in Hyrule.",Best Game Ever?
