,brand,overall,reviewText,summary
282,Nintendo,5,"Super Mario 64 is a game I've wanted to play for ages. I finally decided to purchase it and I was not disappointed. In my opinion Super Mario 64 is the best in the Mario series and one of the best games ever. This game was a breakthrough in 3Dplatformers and it's easy to see why. The 3D is great for its time and the style is incredible.The game is addictive as well. I would play for hours and hours and wouldn't want to stop, and Super Mario 64 does not get tiresome after you beat it for the first time.The plot is simple, Bowser kidnaps Princess Peach and Mario must save her. But the plot's not important in a video game. The game play is what matters.The game is fast paced and you always have new areas to unlock. Despite not having any other areas to go to outside of Princess Peach's castle there are tons of areas inside. Getting to new areas is simple. You need a certain amount of stars to unlock doors, and unlock enough doors to unlock boss doors. Overall, there are 120 stars in the entire game and I would recommend a guide because of how challenging it is.When battling Bowser in this game, I was disappointed. He's so easy. When I beat him the first time I was surprised how easy he was. It was more difficult getting to Bowser than it was battling him. But all three incredible boss stages that were before the battles are so much fun it makes up for it.There are also hidden items, characters and power ups for Mario to find.Now there are a few problems like any other game that I think are quite frustrating. Mario's controls sometimes are a little tough. His wall jumps have to be so precise and if you mess up you have to do it again and again, and the camera sometimes can be tough to use in certain areas. But, despite these problems it's still a great game.This game is a must own for Mario fans. While yet you must already know this since I'm writing this review thirteen years later. : )Super Mario 64 will always be known as one of the best 3Dplatformers in video game history.",Super Mario 64
283,Nintendo,4,"This game is so much fun.  I've always been a big fan of Mario since the beginning.  The graphics are great and the sound is pretty good too.  There are many different goals to reach in each level.  Whether you have to collect coins or stars to open new levels, I know you'll love this game.",Hours of Fun!!!
284,Nintendo,5,"I grew up playing Super Mario 64. If you are considering buying this game, don't hestitate or think twice. This game is really fun. It can keep you entertained for hours. The graphics are simply stunning even by today's standards, considering the age of this game. It is a CLASSIC, MUST HAVE for any N64 players, Mario fans or video game fanatics.",Original. Amazing. Perfection.
286,Nintendo,5,"Super Mario 64 was the first game to be available for the N64. I remember the first time it came out, how it's graphics, music and gameplay really amazed me. Sadly, very few games came after it to give much competition. To this day, it still remains one of the best N64 games out there. The sheer scope of the game is enough to pick it up. It's made up of 20+ levels that can be played in a semi-non linear order. The graphics are bright and clear, and the animations are creative for each character. Gameplay is pretty deep, but extremely intuitive and becomes second nature after playing for a short time. The real plus in this game is the music, some of the most catchiest to be written for a game to date. Pick this one up for both its historical value and for the fact that its a great game.","One of the first, one of the best"
287,Nintendo,5,"This game is coooooollll! Me Abigail has this game and I have 120 stars. They were soo easy to find. I do not know how I became an expert at this. For your information, I am an expert in all of my video games. I must feel like the luckiest girl in the world. But I'll give you a little info:Title: Rainbow ride/ Star#2You'll have to take another magic carpet ride through low-flying areial obstacles to reach the cloud house. The blue blocks that float in your way are bigger on this carpet ride and you'll have to jump on them quickly before the carpet moves out from under your feet. The Magic Carpet will take you through the cloud house twice. On both trips, whatch out for the jet of fire that comes out from the fireplace! I'ts best to stay to the rear of the carpet until the fire is out, then go to theleading ledge of the carpet. If you get knocked off the carpet, it's a log trip back to a spot where you can remount it.( there's a warp to the top of the maze on the Cloud House Balcony.)","Rich ,My Friends, RICH!"
288,Nintendo,5,"Still the best 3D game on the market. Challenging, tons of fun levels and amazing gameplay. A true model for 3D games.",3D entertainment's best to date!
289,Nintendo,5,"When I first played Super Mario 64 as a kid, I was amazed. I never even had the game though. Heck, I never had a Nintendo 64. This game like many other Nintendo 64 titles encouraged me to go out and buy myself a Nintendo 64 16 years after its release. I used to play this game with friends and cousins. Playing it now brings back such great memories. This game is what a game is all about. An unforgettable story, an interesting environment, and overall FUN. This game doesn't get old. In my opinion, it beats out most modern games today. Super Mario 64 formed the basis for all 3-Dimensional video games. If you were considering getting this game, don't consider any longer. GET IT.",This game has nostalgia written all over it!
290,Nintendo,5,"I don't know how many times I've played this game from start to finish.Like a lot of people my decision to buy a N64 was based on the Mario 64 commercials.The WOW factor was in full effect.When I got home and started playing it literally felt like the first time I experienced Atari or the Sega Genesis.Blown away would be an understatement.The game itself?Perfection even with a few minor things.The good.M64 ushered in a whole new age of platforming.Brought us 3D platfroming that was just about perfect in every way.The graphics for it's time were second to none.The control was spot on.The story line was simple but cute like all Mario games.Hidden secrets like being able to wall jump up to the roof.I could go on and on.......The bad?My only gripe is the camera.The camera can get quite wonky in places and funny...even to this day bad cameral angles still plague 3D games.Nintendo and other companies have for the most part gotten the camera down with the free moving camera feature. Too bad some companies are still completely clueless.To summarize.Perfection.Groundbreaking.A legend that spawned a thousand imitators, some good, most...not so good.Can't beat the original.Highest recommendations.",The rebirth of a legend.
291,Nintendo,5,this is an amazing game. one that you can enjoy playing from the start to the finish.,the best mario
292,Nintendo,4,"For anyone who was a fan of video games, they remember the year of 1996:The Playstation made waves and drew many Nintendo fans away with its 32-bit graphics and CD based games. For the first time, Nintendo was being challenged on its own ground and they had to answer Sony with a console of its own. After they put the Super Nintendo system to rest, they went to work and released the Nintendo 64 to the public. The odds were against them because with only two launch titles to choose from, early adopters had to either pick Pilotwings 64 (a good game) or Super Mario 64. This game was the reason Nintendo's console immediately flew off the shelves and showed that Mario can make the jump to 3D and it was fun doing so.I'll make my review short because other reviewers had covered the basics and importance of Super Mario 64. It stars Mario in an open world where each stage is contained within various paintings scattered through Princess Peach's castle. The storyline is pretty typical by now: King Bowser kidnaps the princess and you jump in to rescue her. The graphics are colorful, bright and were a breakthrough in video game technology at the time. The controls are perfect and take almost no time to get used to. It's a pretty challenging game so expect to replay certain stages over and over again. So why did I give it 4.5 stars? The camera is not perfect but back then, getting the camera to work in any open world style game was difficult to program. It always centers behind you but sometimes gets a little wacky when you go up ledges or around corners. It gets annoying after awhile but you learn to tolerate it.What made this game groundbreaking was that games of this type proved to be a challenge to make and to make it fun as well is really the main goal. Super Mario 64 exceeds this and was a commercial success with gamers and gained much critical acclaim from reviewers of virtually every gaming publication. Those who say didn't like were in the minority and for reasons that were just too petty and silly. While gaming has changed tremendously since 1996, this game shows that the platform genre was at one point the kind of games that everyone wanted to play. And now, you can either track down the cartridge or get this for the Nintendo DS. So if you haven't played this, take a look for yourself as to why many gamers loved to play this game. I highly recommend it.",Mario's debut for the N64 (4.5 stars)
293,Nintendo,5,This game is excellent....this game has state of the art graphics for its time....and it still looks perfect now in 2008...you must own this.,This game is perfect.
295,Nintendo,5,"I got this game MANY years ago for the N64, and I just loved it! The game presented a large challenge, while at the same time made it very fun! The music is the best heard in a game, the graphics are superb for an N64 title, and this Mario game is a blast! I guess the most noticeable feature are the environments that the game provides. Every environment that Mario enters is just awesome! I especially love the Rainbow level and the Snow level where all of the penguins are. The best feature is the fact that every age group can enjoy the hours of entertainment from the game and they can all enjoy collecting stars from each stage to save Peach and defeat Bowser. Oh, by the way, the Bowser levels are AWESOME! Fighting Bowser himself is very fun as well! The game is also good in the fact that it provides unsatirical yet not stupid humor as well. This is great for younger gamers. I guess the worst part of Super Mario 64 is the lack of replayability. It's like Vice City where it will take months to play and finish the game, but once it's done, you won't want to play it again without getting bored. Once the ride's over, you'll feel like you can't go play it each day, and the game is kind of wasted in that aspect. Overall, if you are a fan of Mario or Nintendo, then this game may just be suited for your needs! My rating-9.2!",Mario's Best Title
296,Nintendo,4,"I'm not very good at video games, so this game is pretty tough for me.  I only have about 20 stars right now and I've had it about a year!  However, other than the not-so-great 3D graphics and the silly camera angles, it is a fun though challanging game.  I look forward to someday getting all 120 starts!!!  haha",SM64
297,Nintendo,4,"What can I say? This game is fun and funny at the same time. From mario flying around with the magic caps to Mario burning his [...] cheeks on the hot lava, this game is great! My only problem with this game is the freakin camera angles!!! AHHHHH sometimes I feel like I could just kick the Lakitu that controls the thing! Angles sometimes get soooo akward that it makes it difficult to make a jump correctly..or so you won't go flying down to your death. Other than that I give it a 4. Would be 5 if the camera was better.",Great game! Few flaws!
298,Nintendo,5,This game was a very fun game. You basicly go to a castle and you jump into a paintings.. each one leading you into a different world... and in every world... you have to find 7 stars... (one of em is the 100 coin star where you need to collect 100 coins then it pops up it's the hardest star to get)there's 16 worlds in all... most worlds take hours to complete so this game well be well worth it.. This game right here is history... It's one of Nintendo's biggest hits... and when you buy this game you'll soon find out why:),This Is What Every Game Should Be Like
299,Nintendo,5,The best game for the nintendo 64 IS THIS! Yhis game rocks really it does its one of the best n64 game i have ever played 10/10,Best game for n64
300,Nintendo,4,"I bought this game in 1997, over a year after it was released. The first few weeks i played it, i was amazed at the beautiful 3D graphics. Honestly,  i had never seen 3D graphics before this game, so it was awesome and  inspiring.I love this game, so i'm writing this review. There are some  memorable moments from this game (like when Mario ventures into the haunted  mansion or when he goes on a rainbow ride in the skies)All in all, it  showcases the N64 incredible 3D graphics and the sound isn't half  bad.The levels are interesting and sparse ( i beat this game with the  Nintendo Power guidebook) and should take some time to crack the puzzles.  Basically, the game is quite easy and not surprisingly, it has enough  mini-quests and puzzles to keep you occupied. As for level designs, i think  it's excusable considering it's first generation stuff but still deep  enough to immerse you (again) after a long absence...My gripe is while  this game is really good (i mean i'm a big-time Mario fan from the first  mario game), it's only as good as it lasts. I found it hard to go back to  this game after a while- cause it was like having discovered everything and  it made it hard to play through the whole thing again.My advice: play  selectively. You need to get into the mood. While i say that, it's without  doubt that i have never regretted buying this game.Even if i never play  this game again and leave it to collect dust (not likely)-i'll always  remember this game as one of the finest moments of the N64 lifetime (that  is 1996-2001).Anyway, every Super Mario game is groundbreaking (SMB1  created the side-scroller, SMB2 was queer and fun, SMB3 is the greatest  platform game ever, SMB4 was one of the most replayed game i ever played  and this game is mario in 3D without luigi,which is sad)But cheer up  people- the next generation is almost upon us. But i know that when we look  at 3D graphics today, we will know that this game had a part to play in  making this our reality today.",Super Mario 64 has spectacular gameplay!
301,Nintendo,5,i thought i already rated this but i just love amazon dont you? even the reviews are hilarious that i found on youtube and go on smosh on twitter.,great child game
302,Nintendo,5,"Good game for it's time period, kinda miss the old 64 graphics. The cartridge came before it's due date, and it works wonderfully. Thanks.",Yepperz.
303,Nintendo,5,"When I first saw Super Mario 64 in 1996 I had to pick my jaw up off the ground.  While 10 years have passed, I still consider this game of the finest pieces of entertainment I have ever seen.  The kinds of things that the development team pulled off in the mid 90s set the stage for all future video game development and it was, is and always will be groundbreaking.An achievement that should not be ignored and is still as much fun today as it was a decade (DECADE?!!?) ago.***** HIGHEST POSSIBLE RECOMMENDATION",One Of The Greatest Games Ever Made
304,Nintendo,4,"i remember when i was in high school and this game was brand new and just came out. I played this sooooo much, i got an ache in my hand. I've only beaten it once, but i'll tell you what, in that one time, it took me 3 to 4 months to beat it.",best mario game
306,Nintendo,4,"I could knock a few stars off by going on and on about what they SHOULD have put into this game -a playable Princess, animal costumes, Fire Flowers, etc.- but such negativity could foolishly ruin such a great game. Super Mario 64 isn't perfect but it has the best damn gameplay of any action title. The worlds are massive with lots of vibrant colors, whacky enemies, catchy music, and most importantly, gameplay.The only downsides to this game are Mario's horribly annoying voice, an occasionally fussy camera, and the possibility of graining your N64 control stick when you fight Bowser. These minor neusances are mild though and they don't really hinder the gameplay. All other downsides merely point to the characters themselves: Mario speaks with a bad Italian accent voiced by Charles Martinet instead of his old Brooklyn one from the cartoon series. I also don't like the changes made to Princess Toadstool. Instead of the spunky redhead from the cartoon series, she seems more like a ""dumb blonde"" with a weird voice.Yes, this game is old but, like fine wine, games can get better with age.",What can I say? The best 3D action game ever. Period!
307,Nintendo,5,"The 3D age began when Mario was in 3D. A gem for N64!Graphics: 10/10 For a 1996 game, these look great! It's clear and unfuzzy.Sound/music 9/10 Nice music and Mario talks!Gameplay: 10/10 Mario has to go through 15 vast, challanging worlds. Packed with a huge arsnel of moves, he searches for Power Stars in a ""mission"" there are also hidden stars in the castles! If you get all 120, you get a reward! Also, Mario has three cap Powerups: Invisibility, Metal, and Winged. You have to find them though.Believe it or not, I think this is one of the finest entries of the series. A must own! It's also being rereleased for the DS!",How could anybody hate this?!
308,Nintendo,5,"It was incredible to see this game when it came out in 1996, my brother and I had our minds blown. We lived in this game, and Mario Kart and thought entertainment would never be the same. Years ago, this was the one word on Videogames, it revolutionized everything and no one has duplicated it. A must-own and play. It's...just incredible.",This and Shenmue changed my Imagination
309,Nintendo,5,"This game was one of my favorite games on the N64...one of 10 or 12...anyway, this game is stunning graphicly (for it's time) and the gameplay is a blast and challengingyou can find this game on any emulator site...check it out",one of the best N64 games---solidly fun
310,Nintendo,4,"One of the best mario games ever made, it was such a huge jump from the previous consoles looked and played amazingly, hours of entertainment for anyone that enjoys adventure type games.",Classic
311,Nintendo,5,"Super Mario 64, is a Classic pure and simple. And, there's not much else I can say. It's a really good game, With alot of stuff that's fun to come back and do. You, can fly around with your Wing cap, Or Slide down a huge sliding board of Ice! Mario 64 is Pure classic, Pure fun.",A Classic!
312,Nintendo,4,mario was always kind if a hard game for me. i unlocked a lot of stars but a lot of the game went unlocked. i never did beat the whole thing. there are some cheats you can look up online for this game.,ok game
313,Nintendo,5,This is a top classic Mario game. I would highly recommend getting it if you love the Mario series! Very good game!,Thank you so much for to playing my game!
314,Nintendo,5,"I stand behind this game being the best Super Mario game nintendo has produced. Too bad it was on a system that people didn't enjoy - too many complaints over the control and the game selection and graphics capability it was a true underdog. But Super mario 64 has so many good qualitiesthis game takes forever to beat. Some may think this is a nusance but its filled with many many wonderful levels of funeach level is unique and its organized in a wonderful fashion, you never get too confused in nagivating the gameThere is ALWAYS something new to find, and many races and somewhat minigames that are actually entertaining and not ultimately annoy you.You get frusterated when you lose, you realize this isn't some easy game  you can breeze through, its actually difficult - appreciate that challenge because challenge is hard to come by in games these days.Graphics aren't overdone. Good, you can find flaws, especially these days, the angles may alert some gamers as being old fashioned, but think about it like this... its not 2D. lol.Overall, I love this game. Without a doubt, I consider it amongst the top 3 of my favorite games. If you haven't played this game, you are really missing out on something, go play it, you'll see how fun and exciting this game can be. and believe me - it only gets better.",Best Mario Game EVER
315,Nintendo,4,"Super Mario 64 has some of the best graphics ever shown on a home console.Believe it or not but I like the graphics in Super Mario 64 more than the graphics in Super Mario Sunshine.Sure the levels look great and have snappy tunes to match but the game is way too easy except for Bowser.Mario 64 is overrated but still one of the best games ever made.It isnt the best game of all time but it packs a powerful punch.Lets hope Super Mario 128 is even better with harder challenges,better graphics and more levels. I mean Mario 64 was great but the sequel should be harder because I dont really want to own 2 Mario games that are too easy and not long enough.",Its very overrated even though its still a great game.
316,Nintendo,5,the original party game. the nostalgia that this game brings back makes it a must buy!one of the best games of all times,must own for that old school feel
317,Nintendo,5,"So what is Mario's quest this time? Save the Princess ""Peach"" by defeating the evil Bowser, while collecting 70 stars in only 15 levels (all 15 levels are contained in 1 huge castle). It might not be the best Mario game, but it offers a new 3D world and a whole new realism. It also has new features such as an energy feature, where rather than collecting power-ups like the fire flower, you now collect a gold coin and you get a block of energy back! Now Mario has far more of an offense rather than just stomping enemies, he can now throw punches, kicks and slide into enemies, making full use of the 3D plane. The enemies come to life in 3D, such as huge chain chomps, menacing goombas and annoying koopas The graphics could have been better, because they make enemies out of simple colors rather than textures like more recent games have. The music and sound effects are nice, because Mario now has a voice to be heard. There are however only minimal power-ups, such as Mario's Winged hat, which allows him to fly, and Mario's steel cap, making him invincible.",Adding new elements to Mario in a 3D world
318,Nintendo,5,i dont think i really need to tell you why this game is amazing if you have played it you already know,100.00%
319,Nintendo,5,"In these decades of the digital world with superior hardware and high definition graphics, I don't believe gamers will ever encounter the same life changing experience as those who have first hand seen Mario evolve into a 3D masterpiece.  The Nintendo 64 is the best console of its time HANDS DOWN!! and Super Mario 64 is a MASTERPIECE.","Best Game of it's time, HANDS DOWN!!!!"
320,Nintendo,5,"Probably the most epic of the first generation of 3D platformers, and certainly one of the most well-known. With 120 stars to collect, you can spend quite a bit of time working up the perfect game. Just don't go for that &#34;unlocking Luigi&#34; nonsense. It was all an urban legend.",It's Mario 64. What more can be said?
321,Nintendo,4,"this is wat made me love mario. mario 64!this is the biggest game crammed into a cartridge ive seen, its musically awesome, graphically it shows age, and the camera isnt as good as it could be, but I still havent beaten it since then! thats how massive & how much gameplay there is to it!I remember sliding down caves & smashing boulders back in the day, now that a friend sold it to me, Im in love with it!",Mario 64 Introduced me to 3D games
322,Nintendo,5,Here's a cool trick!(you have to have the 2nd key you get from Bowser)Topic:Snowman has your hatSent in from:AnubisGet your blown off by the big snowman. Don't pick your hat up at all. Instead go get a star (It dosn't have to be a new star)and save and turn off N64. Wait 10 seconds.....now turn N64 back on.Go back to that level and one of the little snowmen that pops out of the snow will have Mario's hat on their head.,M-A-R-I-O!
323,Nintendo,5,Where are all the green pipes!!!Why is there no coin counter for running around the Castle! There are coins all over the place! I want to collect a 100 coin castle star! Did you even think before you sent this to production BRO! Is this even this games final form?!?THE CAKE WAS A LIE!!!,Inconsistencies?
324,Nintendo,5,I have been playing video games for years. My first console was the original Nintendo and then the Super Nintendo followed by the Nintendo 64. Super Mario 64 came out when I was about 10 years old and it was an instant hit. Super Mario 64 was the greatest Super Mario game of them all. My nephew has a Nintendo 64 and he wants some new games for his birthday. I thought what's better than Super Mario 64. I bought this for his birthday and he will love it. I would recommend Super Mario 64 to anyone who wants to play a fun and family oriented Mario game.,A True Classic Mario Game
325,Nintendo,5,I Love this game it's the best Mario game on Nintendo 64. It is fun and everyone would love playing this game.,Super Mario 64 is the best Mario game there is.
326,Nintendo,5,This is one of the best games ever made for the N64 console.It will always be a reminder of my younger years and my kids love it.,Nostalgia
